word,definition
opah,large elliptical brightly colored deep-sea fish of Atlantic and Pacific and Mediterranean
opal,a translucent mineral consisting of hydrated silica of variable color; some varieties are used as gemstones
open,a clear or unobstructed space or expanse of land or water
opus,a musical work that has been created
orad,toward the mouth or oral region
oral,an examination conducted by spoken communication
orca,predatory black-and-white toothed whale with large dorsal fin; common in cold seas
orgy,any act of immoderate indulgence
oryx,large African antelope with long straight nearly upright horns
otic,of or relating to near the ear
otis,United States inventor who manufactured the first elevator with a safety device (1811-1861)
otus,a genus of Strigidae
ours,
oust,remove from a position or office
oval,a closed plane curve resulting from the intersection of a circular cone and a plane cutting completely through it
oven,kitchen appliance used for baking or roasting
over,(cricket) the division of play during which six balls are bowled at the batsman by one player from the other team from the same end of the pitch
ovis,sheep
ovum,the female reproductive cell; the female gamete
owen,Welsh industrialist and social reformer who founded cooperative communities (1771-1858)
oxen,domesticated bovine animals as a group regardless of sex or age; ; ; - Bible
paba,a metabolic acid found in yeast and liver cells; used to make dyes and drugs and sun blockers
paca,large burrowing rodent of South America and Central America; highly esteemed as food
pace,the rate of moving (especially walking or running)
pack,a large indefinite number
pact,a written agreement between two states or sovereigns
page,one side of one leaf (of a book or magazine or newspaper or letter etc.) or the written or pictorial matter it contains
pail,a roughly cylindrical vessel that is open at the top
pain,a symptom of some physical hurt or disorder
pair,a set of two similar things considered as a unit
pale,a wooden strip forming part of a fence
pali,an ancient Prakrit language (derived from Sanskrit) that is the scriptural and liturgical language of Theravada Buddhism
pall,a sudden numbing dread
palm,the inner surface of the hand from the wrist to the base of the fingers
pane,sheet glass cut in shapes for windows or doors
pang,a sudden sharp feeling
pant,the noise made by a short puff of steam (as from an engine)
papa,an informal term for a father; probably derived from baby talk
para,(obstetrics) the number of liveborn children a woman has delivered
pare,decrease gradually or bit by bit
park,a large area of land preserved in its natural state as public property
parr,Queen of England as the 6th wife of Henry VIII (1512-1548)
part,something determined in relation to something that includes it
pass,(baseball) an advance to first base by a batter who receives four balls
past,the time that has elapsed
pate,liver or meat or fowl finely minced or ground and variously seasoned
path,a course of conduct
paul,United States feminist (1885-1977)
pave,a setting with precious stones so closely set that no metal shows
pavo,a small constellation near the South Pole between Tucana and Ara
pawl,a hinged catch that fits into a notch of a ratchet to move a wheel forward or prevent it from moving backward
pawn,an article deposited as security
peag,small cylindrical beads made from polished shells and fashioned into strings or belts; used by certain Native American peoples as jewelry or currency
peak,the most extreme possible amount or value
peal,a deep prolonged sound (as of thunder or large bells)
pean,(ancient Greece) a hymn of praise (especially one sung in ancient Greece to invoke or thank a deity)
pear,sweet juicy gritty-textured fruit available in many varieties
peat,partially carbonized vegetable matter saturated with water; can be used as a fuel when dried
peba,having nine hinged bands of bony plates; ranges from Texas to Paraguay
peck,(often followed by `of') a large number or amount or extent
peed,eliminate urine
peek,a secret look
peel,British politician (1788-1850)
peen,the part of a hammerhead opposite the flat striking surface (may have various shapes)
peep,the short weak cry of a young bird
peer,a person who is of equal standing with another in a group
pelf,informal terms for money
pelt,the dressed hairy coat of a mammal
pent,produce a literary work
peon,a laborer who is obliged to do menial work
peri,a beautiful and graceful girl
perk,an incidental benefit awarded for certain types of employment (especially if it is regarded as a right)
perm,a city in the European part of Russia
pert,characterized by a lightly pert and exuberant quality
peru,a republic in western South America; achieved independence from Spain in 1821; was the heart of the Inca empire from the 12th to 16th centuries
peso,the basic unit of money in Uruguay; equal to 100 centesimos
pess,the part of the leg of a human being below the ankle joint
pest,a serious (sometimes fatal) infection of rodents caused by Yersinia pestis and accidentally transmitted to humans by the bite of a flea that has bitten an infected animal
peul,a family of languages of the Fulani of West Africa and used as a lingua franca in the sub-Saharan regions from Senegal to Chad; the best known of the West African languages
phiz,English illustrator of several of Dickens' novels (1815-1882)
phon,a unit of subjective loudness
phot,"a unit of illumination equal to 1 lumen per square centimeter; 10,000 phots equal 1 lux"
pica,"an eating disorder, frequent in children, in which non-nutritional objects are eaten persistently"
pick,the person or thing chosen or selected
pied,having sections or patches colored differently and usually brightly
pier,a platform built out from the shore into the water and supported by piles; provides access to ships and boats
pika,small short-eared burrowing mammal of rocky uplands of Asia and western North America
pike,a broad highway designed for high-speed traffic
pile,a collection of objects laid on top of each other
pill,something that resembles a tablet of medicine in shape or size
pima,a member of the North American Indian people living in southern Arizona and northern Mexico
pimp,someone who procures customers for whores (in England they call a pimp a ponce)
pine,a coniferous tree
ping,a river in western Thailand; a major tributary of the Chao Phraya
pink,a light shade of red
pint,a British imperial capacity measure (liquid or dry) equal to 4 gills or 568.26 cubic centimeters
pipa,type genus of the Pipidae
pipe,a tube with a small bowl at one end; used for smoking tobacco
piss,liquid excretory product
pita,usually small round bread that can open into a pocket for filling
pith,soft spongelike central cylinder of the stems of most flowering plants
pity,a feeling of sympathy and sorrow for the misfortunes of others
pixy,creeping evergreen shrub having narrow overlapping leaves and early white star-shaped flowers; of the pine barrens of New Jersey and the Carolinas
plan,a series of steps to be carried out or goals to be accomplished
plat,a map showing planned or actual features of an area (streets and building lots etc.)
play,a dramatic work intended for performance by actors on a stage
plea,a humble request for help from someone in authority
pleb,one of the common people
pled,appeal or request earnestly
plod,the act of walking with a slow heavy gait
plop,the noise of a rounded object dropping into a liquid without a splash
plot,a secret scheme to do something (especially something underhand or illegal)
plow,a farm tool having one or more heavy blades to break the soil and cut a furrow prior to sowing
ploy,an opening remark intended to secure an advantage for the speaker
plug,blockage consisting of an object designed to fill a hole tightly
plum,any of several trees producing edible oval fruit having a smooth skin and a single hard stone
plus,a useful or valuable quality
pobs,a numbered compartment in a post office where mail is put to be called for
pock,a pustule in an eruptive disease
poem,a composition written in metrical feet forming rhythmical lines
poet,a writer of poems (the term is usually reserved for writers of good poetry)
pogy,money received from the state
poke,tall coarse perennial American herb having small white flowers followed by blackish-red berries on long drooping racemes; young fleshy stems are edible; berries and root are poisonous
poky,a correctional institution used to detain persons who are in the lawful custody of the government (either accused persons awaiting trial or convicted persons serving a sentence)
pole,a long (usually round) rod of wood or metal or plastic
polk,11th President of the United States; his expansionism led to the Mexican War and the annexation of California and much of the southwest (1795-1849)
poll,an inquiry into public opinion conducted by interviewing a random sample of people
polo,Venetian traveler who explored Asia in the 13th century and served Kublai Khan (1254-1324)
pome,a fleshy fruit (apple or pear or related fruits) having seed chambers and an outer fleshy part
pomo,a member of an Indian people of northern California living along the Russian River valley and adjacent Pacific coast
pomp,cheap or pretentious or vain display
pond,a small lake
pone,cornbread often made without milk or eggs and baked or fried (southern)
pong,an unpleasant smell
pony,a range horse of the western United States
poof,offensive term for an openly homosexual man
pool,an excavation that is (usually) filled with water
poon,wood of any poon tree; used for masts and spars
poop,obscene terms for feces
poor,people without possessions or wealth (considered as a group)
pope,the head of the Roman Catholic Church
pore,any tiny hole admitting passage of a liquid (fluid or gas)
pork,meat from a domestic hog or pig
port,a place (seaport or airport) where people and merchandise can enter or leave a country
pose,affected manners intended to impress others
posh,elegant and fashionable; ; ; ; - Julia Child
post,the position where someone (as a guard or sentry) stands or is assigned to stand
posy,an arrangement of flowers that is usually given as a present
pouf,offensive term for an openly homosexual man
pour,cause to run
pout,a disdainful grimace
pram,a small vehicle with four wheels in which a baby or child is pushed around
prat,the fleshy part of the human body that you sit on
pray,"address a deity, a prophet, a saint or an object of worship; say a prayer"
prep,preparatory school work done outside school (especially at home)
prey,a person who is the aim of an attack (especially a victim of ridicule or exploitation) by some hostile person or influence
prig,a person regarded as arrogant and annoying
prim,assume a prim appearance
prod,a verbalization that encourages you to attempt something
prof,someone who is a member of the faculty at a college or university
prop,a support placed beneath or against something to keep it from shaking or falling
prow,front part of a vessel or aircraft
puce,a color varying from dark purplish brown to dark red
puck,a mischievous sprite of English folklore
puff,a short light gust of air
puka,South American shrub or small tree having long shining evergreen leaves and panicles of green or yellow flowers
puke,a person who is deemed to be despicable or contemptible
puku,an African antelope closely related to the waterbuck
pule,cry weakly or softly
puli,100 puls equal 1 afghani in Afghanistan
pull,the act of pulling; applying force to move something toward or with you
pulp,any soft or soggy mass
puma,large American feline resembling a lion
pump,a mechanical device that moves fluid or gas by pressure or suction
pung,a one-horse sleigh consisting of a box on runners
punk,an aggressive and violent young criminal
punt,formerly the basic unit of money in Ireland; equal to 100 pence
puny,inferior in strength or significance
pupa,an insect in the inactive stage of development (when it is not feeding) intermediate between larva and adult
pure,free of extraneous elements of any kind
purl,gold or silver wire thread
purr,a low vibrating sound typical of a contented cat
push,the act of applying force in order to move something away
puss,obscene terms for female genitals
putt,hitting a golf ball that is on the green using a putter
pyre,wood heaped for burning a dead body as a funeral rite
qoph,the 19th letter of the Hebrew alphabet
quad,one of four children born at the same time from the same pregnancy
quag,a soft wet area of low-lying land that sinks underfoot
quat,the leaves of the shrub Catha edulis which are chewed like tobacco or used to make tea; has the effect of a euphoric stimulant
quay,wharf usually built parallel to the shoreline
quid,the basic unit of money in Great Britain and Northern Ireland; equal to 100 pence
quin,one of five children born at the same time from the same pregnancy
quip,a witty saying
quit,put an end to a state or an activity
quiz,an examination consisting of a few short questions
race,any competition
rack,framework for holding objects
racy,full of zest or vigor
raft,a flat float (usually made of logs or planks) that can be used for transport or as a platform for swimmers
rage,a feeling of intense anger
raid,a sudden short attack
rail,a barrier consisting of a horizontal bar and supports
rain,water falling in drops from vapor condensed in the atmosphere
raja,a prince or king in India
rake,a dissolute man in fashionable society
rama,avatar of Vishnu whose name is synonymous with God; any of three incarnations: Ramachandra or Parashurama or Balarama
rami,the posterior part of the mandible that is more or less vertical
ramp,an inclined surface connecting two levels
rana,type genus of the Ranidae
rand,the basic unit of money in South Africa; equal to 100 cents
rang,sound loudly and sonorously
rani,(the feminine of raja) a Hindu princess or the wife of a raja
rank,a row or line of people (especially soldiers or police) standing abreast of one another
rant,a loud bombastic declamation expressed with strong emotion
rape,Eurasian plant cultivated for its seed and as a forage crop
rapt,feeling great rapture or delight
rare,not widely known; especially valued for its uncommonness
rase,tear down so as to make flat with the ground
rash,any red eruption of the skin
rasp,uttering in an irritated tone
rate,a magnitude or frequency relative to a time unit
rave,a dance party that lasts all night and electronically synthesized music is played
raze,tear down so as to make flat with the ground
razz,a cry or noise made to express displeasure or contempt
read,something that is read
real,any rational or irrational number
ream,a large quantity of written matter
reap,"gather, as of natural products"
rear,the back of a military formation or procession
rede,give an interpretation or explanation to
redo,make new
reed,tall woody perennial grasses with hollow slender stems especially of the genera Arundo and Phragmites
reef,a submerged ridge of rock or coral near the surface of the water
reek,a distinctive odor that is offensively unpleasant
reel,a roll of photographic film holding a series of frames to be projected by a movie projector
reft,steal goods; take as spoils
reid,Scottish philosopher of common sense who opposed the ideas of David Hume (1710-1796)
rein,one of a pair of long straps (usually connected to the bit or the headpiece) used to control a horse
reis,any rational or irrational number
reit,an investment trust that owns and manages a pool of commercial properties and mortgages and other real estate assets; shares can be bought and sold in the stock market
rely,have confidence or faith in
rend,tear or be torn violently
rent,"a payment or series of payments made by the lessee to an owner for use of some property, facility, equipment, or service"
repp,a fabric with prominent rounded crosswise ribs
reps,informal abbreviation of `representative'
resh,the 20th letter of the Hebrew alphabet
rest,something left after other parts have been taken away
rhea,fertility goddess in ancient Greek mythology; wife of Cronus and mother of Zeus; identified with Roman Ops and Cybele of ancient Asia Minor
rhus,"deciduous or evergreen shrubs and shrubby trees of temperate and subtropical North America, South Africa, eastern Asia and northeastern Australia; usually limited to nonpoisonous sumacs (see genus Toxicodendron)"
rial,the basic unit of money in Yemen; equal to 100 fils
rice,grains used as food either unpolished or more often polished
rich,people who have possessions and wealth (considered as a group)
rick,a painful muscle spasm especially in the neck or back (`rick' and `wrick' are British)
ride,a journey in a vehicle (usually an automobile)
rife,most frequent or common
riff,a Berber living in northern Morocco
rift,a gap between cloud masses
rile,"cause annoyance in; disturb, especially by minor irritations"
rill,a small stream
rima,a narrow elongated opening or fissure between two symmetrical parts
rime,ice crystals forming a white deposit (especially on objects outside)
rimu,tall New Zealand timber tree
rimy,covered with frost; ; -Wm.Faulkner
rind,the natural outer covering of food (usually removed before eating)
ring,a characteristic sound
rink,building that contains a surface for ice skating or roller skating
riot,a public act of violence by an unruly mob
ripe,fully developed or matured and ready to be eaten or used
rise,a growth in strength or number or importance
risk,a source of danger; a possibility of incurring loss or misfortune
rite,an established ceremony prescribed by a religion
rive,tear or be torn violently
road,an open way (generally public) for travel or transportation
roam,"move about aimlessly or without any destination, often in search of food or employment"
roan,a soft sheepskin leather that is colored and finished to resemble morocco; used in bookbinding
roar,a deep prolonged loud noise
robe,any loose flowing garment
rock,a lump or mass of hard consolidated mineral matter
rode,"sit and travel on the back of animal, usually while controlling its motions"
roil,be agitated
role,the actions and activities assigned to or required or expected of a person or group
rolf,Norse chieftain who became the first duke of Normandy (860-931)
roll,rotary motion of an object around its own axis
rome,capital and largest city of Italy; on the Tiber; seat of the Roman Catholic Church; formerly the capital of the Roman Republic and the Roman Empire
romp,an easy victory
rood,representation of the cross on which Jesus died
roof,a protective covering that covers or forms the top of a building
rook,(chess) the piece that can move any number of unoccupied squares in a direction parallel to the sides of the chessboard
room,an area within a building enclosed by walls and floor and ceiling
root,(botany) the usually underground organ that lacks buds or leaves or nodes; absorbs water and mineral salts; usually it anchors the plant to the ground
rope,a strong line
ropy,of or resembling rope (or ropes) in being long and strong
rosa,large genus of erect or climbing prickly shrubs including roses
rose,any of many shrubs of the genus Rosa that bear roses
ross,Scottish explorer who led Arctic expeditions that yielded geographic discoveries while searching for the Northwest Passage (1777-1856)
rosy,reflecting optimism
rota,(Roman Catholic Church) the supreme ecclesiastical tribunal for cases appealed to the Holy See from diocesan courts
rote,memorization by repetition
roue,a dissolute man in fashionable society
rout,a disorderly crowd of people
rove,"move about aimlessly or without any destination, often in search of food or employment"
rube,a person who is not very intelligent or interested in culture
ruby,a transparent piece of ruby that has been cut and polished and is valued as a precious gem
ruck,a crowd especially of ordinary or undistinguished persons or things
rudd,European freshwater fish resembling the roach
rude,socially incorrect in behavior
ruff,an external body part consisting of feathers or hair about the neck of a bird or other animal
ruga,(anatomy) a fold or wrinkle or crease
ruin,an irrecoverable state of devastation and destruction
rule,a principle or condition that customarily governs behavior
rump,the part of an animal that corresponds to the human buttocks
rune,any character from an ancient Germanic alphabet used in Scandinavia from the 3rd century to the Middle Ages
rung,a crosspiece between the legs of a chair
runt,disparaging terms for small people
ruse,a deceptive maneuver (especially to avoid capture)
rush,the act of moving hurriedly and in a careless manner
rusk,slice of sweet raised bread baked again until it is brown and hard and crisp
russ,the medieval Russian state established by Scandinavian traders in the 9th century; the capital was first in Novgorod and then in Kiev
rust,a red or brown oxide coating on iron or steel caused by the action of oxygen and moisture
ruta,type genus of the Rutaceae; strong-scented Eurasian herbs
ruth,United States professional baseball player famous for hitting home runs (1895-1948)
saba,a island in the Netherlands Antilles that is the top of an extinct volcano
sack,a bag made of paper or plastic for holding customer's purchases
sade,French soldier and writer whose descriptions of sexual perversion gave rise to the term `sadism' (1740-1814)
safe,strongbox where valuables can be safely kept
saga,a narrative telling the adventures of a hero or a family; originally (12th to 14th centuries) a story of the families that settled Iceland and their descendants but now any prose narrative that resembles such an account
sage,a mentor in spiritual and philosophical topics who is renowned for profound wisdom
sago,powdery starch from certain sago palms; used in Asia as a food thickener and textile stiffener
said,express in words
sail,a large piece of fabric (usually canvas fabric) by means of which wind is used to propel a sailing vessel
sake,a reason for wanting something done
saki,British writer of short stories (1870-1916)
sale,a particular instance of selling
salp,minute floating marine tunicate having a transparent body with an opening at each end
salt,a compound formed by replacing hydrogen in an acid by a metal (or a radical that acts like a metal)
same,a member of an indigenous nomadic people living in northern Scandinavia and herding reindeer
sand,a loose material consisting of grains of rock or coral
sane,mentally healthy; free from mental disorder
sang,North American woodland herb similar to and used as substitute for the Chinese ginseng
sank,fall or descend to a lower place or level
sard,a deep orange-red variety of chalcedony
sari,a dress worn primarily by Hindu women; consists of several yards of light material that is draped around the body
sash,a framework that holds the panes of a window in the window frame
sate,fill to satisfaction
saul,(Old Testament) the first king of the Israelites who defended Israel against many enemies (especially the Philistines)
save,(sports) the act of preventing the opposition from scoring
sawn,cut with a saw
saxe,a French marshal who distinguished himself in the War of the Austrian Succession (1696-1750)
scab,someone who works (or provides workers) during a strike
scad,any of a number of fishes of the family Carangidae
scam,a fraudulent business scheme
scan,the act of scanning; systematic examination of a prescribed region
scar,a mark left (usually on the skin) by the healing of injured tissue
scat,singing jazz; the singer substitutes nonsense syllables for the words of the song and tries to sound like a musical instrument
scot,a native or inhabitant of Scotland
scow,any of various flat-bottomed boats with sloping ends
scry,divine by gazing into crystals
scud,the act of moving along swiftly (as before a gale)
scum,worthless people
scup,flesh of fish found in colder waters of northern Atlantic coast of the United States
scut,a short erect tail
seal,fastener consisting of a resinous composition that is plastic when warm; used for sealing documents and parcels and letters
seam,joint consisting of a line formed by joining two pieces
sear,make very hot and dry
seat,a space reserved for sitting (as in a theater or on a train or airplane)
sect,a subdivision of a larger religious group
seed,a small hard fruit
seek,the movement of a read/write head to a specific data track on a disk
seel,sew up the eyelids of hawks and falcons
seem,give a certain impression or have a certain outward aspect
seen,perceive by sight or have the power to perceive by sight
seep,pass gradually or leak through or as if through small openings
seer,a person with unusual powers of foresight
self,your consciousness of your own identity
sell,the activity of persuading someone to buy
semi,one of the two competitions in the next to the last round of an elimination tournament
send,cause to go somewhere
sent,100 senti equal 1 kroon in Estonia
seps,the month following August and preceding October
sept,the month following August and preceding October
sera,"an amber, watery fluid, rich in proteins, that separates out when blood coagulates"
serb,a member of a Slavic people who settled in Serbia and neighboring areas in the 6th and 7th centuries
sere,(used especially of vegetation) having lost all moisture
serf,(Middle Ages) a person who is bound to the land and owned by the feudal lord
sess,street names for marijuana
seta,stalk of a moss capsule
seth,(Old Testament) third son of Adam and Eve; given by God in place of the murdered Abel
sett,rectangular paving stone with curved top; once used to make roads
sewn,fasten by sewing; do needlework
sext,the fourth of the seven canonical hours; about noon
sexy,marked by or tending to arouse sexual desire or interest
shad,bony flesh of herring-like fish usually caught during their migration to fresh water for spawning; especially of Atlantic coast
shag,a strong coarse tobacco that has been shredded
shah,title for the former hereditary monarch of Iran
