word,definition
cultist,a member of a religious cult
culture,a particular society at a particular time and place
culvert,a transverse and totally enclosed drain under a road or railway
cumulus,a globular cloud
cuneate,"(of a leaf shape) narrowly triangular, wider at the apex and tapering toward the base"
cunning,shrewdness as demonstrated by being skilled in deception
cupcake,small cake baked in a muffin tin
cupping,a treatment in which evacuated cups are applied to the skin to draw blood through the surface
cuprite,a mineral consisting of cuprous oxide that is a source of copper
cuprous,of or containing divalent copper
curable,curing or healing is possible
curacao,a popular island resort in the Netherlands Antilles
curator,the custodian of a collection (as a museum or library)
curbing,an edge between a sidewalk and a roadway consisting of a line of curbstones (usually forming part of a gutter)
curcuma,tropical Asiatic perennial herbs
curette,a surgical instrument shaped like a scoop to remove tissue from a bodily cavity
curiosa,books on strange or unusual subjects (especially erotica)
curious,beyond or deviating from the usual or expected
curling,a game played on ice in which heavy stones with handles are slid toward a target
currant,any of several tart red or black berries used primarily for jellies and jams
current,a flow of electricity through a conductor
curried,season with a mixture of spices; typical of Indian cooking
currier,United States lithographer who (with his partner James Ives) produced thousands of prints signed `Currier & Ives' (1813-1888)
currish,base and cowardly
cursive,rapid handwriting in which letters are set down in full and are cursively connected within words without lifting the writing implement from the paper
cursory,hasty and without attention to detail; not thorough
curtail,place restrictions on
curtain,hanging cloth used as a blind (especially for a window)
cuscuta,genus of twining leafless parasitic herbs lacking chlorophyll: dodder
cushion,a mechanical damper; absorbs energy of sudden impulses
cuspate,having cusps or points
custard,sweetened mixture of milk and eggs baked or boiled or frozen
custody,a state of being confined (usually for a short time)
customs,money collected under a tariff
cutaway,a representation (drawing or model) of something in which the outside is omitted to reveal the inner parts
cutback,a reduction in quantity or rate
cuticle,the dead skin at the base of a fingernail or toenail
cutlass,a short heavy curved sword with one edge; formerly used by sailors
cutlery,a cutting implement; a tool for cutting
cutting,the activity of selecting the scenes to be shown and putting them together to create a film
cutwork,embroidery in which the design is outlined in a buttonhole stitch and the intervening material is cut away
cutworm,North American moth whose larvae feed on young plant stems cutting them off at the ground
cyanide,any of a class of organic compounds containing the cyano radical -CN
cyanite,"a grey or greenish-blue mineral consisting of aluminum silicate in crystalline form; occurs in metaphoric rock, used as a refractory"
cyathea,type genus of the Cyatheaceae: tree ferns of the tropical rain forest to temperate woodlands
cycling,the sport of traveling on a bicycle or motorcycle
cyclist,a person who rides a bicycle
cycloid,a line generated by a point on a circle rolling along a straight line
cyclone,(meteorology) rapid inward circulation of air masses about a low pressure center; circling counterclockwise in the northern hemisphere and clockwise in the southern
cyclops,(Greek mythology) one of a race of giants having a single eye in the middle of their forehead
cydonia,quince
cymling,squash plant having flattened round fruit with a scalloped edge; usually greenish white
cynical,believing the worst of human nature and motives; having a sneering disbelief in e.g. selflessness of others
cynodon,creeping perennial grasses of tropical and southern Africa
cynomys,prairie dogs
cynthia,(Greek mythology) the virgin goddess of the hunt and the Moon; daughter of Leto and twin sister of Apollo; identified with Roman Diana
cyperus,type genus of Cyperaceae; grasslike rhizomatous herbs; cosmopolitan except very cold regions
cypraea,type genus of the family Cypraeidae: the typical cowries
cypress,wood of any of various cypress trees especially of the genus Cupressus
cyprian,a woman who engages in sexual intercourse for money
cyrilla,shrub or small tree of southeastern United States to West Indies and Brazil; grown for the slender racemes of white flowers and orange and crimson foliage
cystine,a crystalline amino acid found in proteins (especially keratin); discovered in bladder stones
cytisus,large genus of stiff or spiny evergreen or deciduous Old World shrubs: broom
czarina,the wife or widow of a czar
czarist,of or relating to or characteristic of a czar
dabbler,an amateur who engages in an activity without serious intentions and who pretends to have knowledge
dacitic,relating to or consisting of dacite
dacoity,robbery by a gang of armed dacoits
dacryon,the craniometric point at the junction of the anterior border of the lacrimal bone with the frontal bone
dadaism,a nihilistic art movement (especially in painting) that flourished in Europe early in the 20th century; based on irrationality and negation of the accepted laws of beauty
daggers,a short knife with a pointed blade used for piercing or stabbing
dallier,someone who wastes time
damages,a sum of money paid in compensation for loss or injury
damning,wish harm upon; invoke evil upon
damping,"deaden (a sound or noise), especially by wrapping"
dampish,slightly wet
dancing,taking a series of rhythmical steps (and movements) in time to music
dandify,dress like a dandy
dandily,in a dandy manner
dantean,of or relating to Dante Alighieri or his writings
daphnia,minute freshwater crustacean having a round body enclosed in a transparent shell; moves about like a flea by means of hairy branched antennae
dappled,colour with streaks or blotches of different shades
darkish,slightly dark
darling,a special loved one
darning,the act of mending a hole in a garment with crossing threads
darting,move along rapidly and lightly; skim or dart
dasheen,edible starchy tuberous root of taro plants
dashing,run or move very quickly or hastily
dastard,a despicable coward
dasypus,type genus of the Dasypodidae
dasyure,any of several more or less arboreal marsupials somewhat resembling martens
datable,that can be given a date; - C.W.Shumaker
daubing,the application of plaster
dauphin,"formerly, the eldest son of the King of France and direct heir to the throne"
dawdler,someone who takes more time than necessary; someone who lags behind
dawning,the first light of day
daybook,a ledger in which transactions have been recorded as they occurred
daylong,lasting through an entire day
daystar,a planet (usually Venus) seen just before sunrise in the eastern sky
daytime,the time after sunrise and before sunset while it is light outside
dazedly,in a daze; in a dazed manner
deadeye,a dead shot
deadpan,deliberately impassive in manner
dealing,method or manner of conduct in relation to others
deanery,the official residence of a dean
deathly,having the physical appearance of death
debacle,a sudden and violent collapse
debaser,a person who lowers the quality or character or value (as by adding cheaper metal to coins)
debater,someone who engages in debate
debauch,a wild gathering involving excessive drinking and promiscuity
debouch,march out (as from a defile) into open ground
debrief,put someone through a debriefing and make him report
decagon,a polygon with 10 sides and 10 angles
decapod,crustaceans characteristically having five pairs of locomotor appendages each joined to a segment of the thorax
decayed,"lose a stored charge, magnetic flux, or current"
decease,the event of dying or departure from life
deceive,be false to; be dishonest with
decency,the quality of conforming to standards of propriety and morality
decibel,a logarithmic unit of sound intensity; 10 times the logarithm of the ratio of the sound intensity to some reference intensity
decided,"reach, make, or come to a decision about something"
decidua,the epithelial tissue of the endometrium
decimal,a proper fraction whose denominator is a power of 10
decking,be beautiful to look at
declaim,recite in elocution
declare,state emphatically and authoritatively
decline,change toward something smaller or lower
decolor,remove color from
decorum,propriety in manners and conduct
decried,express strong disapproval of
deedbox,a strongly made box for holding money or valuables; can be locked
defamed,charge falsely or with malicious intent; attack the good name and reputation of someone
defamer,one who attacks the reputation of another by slander or libel
default,loss due to not showing up
defence,(psychiatry) an unconscious process that tries to reduce the anxiety associated with instinctive desires
defense,(military) military action or resources protecting a country against potential enemies
defiant,boldly resisting authority or an opposing force
deficit,the property of being an amount by which something is less than expected or required
defiled,place under suspicion or cast doubt upon
defiler,a person or organization that causes pollution of the environment
defined,determine the essential quality of
deflate,collapse by releasing contained air or gas
deflect,prevent the occurrence of; prevent from happening
defraud,deprive of by deceit
defrock,divest of the frock; of church officials
defrost,make or become free of frost or ice
defunct,no longer in force or use; inactive
degauss,make nonmagnetic; take away the magnetic properties (of)
deglaze,dissolve cooking juices or solid food in (a pan) by adding liquid and stirring
degrade,"reduce the level of land, as by erosion"
dehisce,burst or split open
deictic,a word specifying identity or spatial or temporal location from the perspective of a speaker or hearer in the context in which the communication occurs; - R.Rommetveit
deistic,of or relating to deism
delayer,a person who delays; to put off until later or cause to be late
delible,capable of being deleted
delight,a feeling of extreme pleasure or satisfaction
delilah,(Old Testament) the Philistine mistress of Samson who betrayed him by cutting off his hair and so deprived him of his strength
delimit,determine the essential quality of
deliver,"deliver (a speech, oration, or idea)"
delouse,free of lice
deltoid,a large triangular muscle covering the shoulder joint and serving to abduct and flex and extend and rotate the arm
demagog,a political leader who seeks support by appealing to popular passions and prejudices
demerit,a mark against a person for misconduct or failure; usually given in school or armed forces
demerol,a synthetic narcotic drug (trade name Demerol) used to treat pain
demesne,extensive landed property (especially in the country) retained by the owner for his own use
demigod,a person with great powers and abilities
demonic,extremely evil or cruel; expressive of cruelty or befitting hell
demotic,a simplified cursive form of the ancient hieratic script
denizen,a person who inhabits a particular place
denmark,a constitutional monarchy in northern Europe; consists of the mainland of Jutland and many islands between the North Sea and the Baltic Sea
densely,in a stupid manner
density,the amount per unit size
dentate,having toothlike projections in the margin
dentine,a calcareous material harder and denser than bone that comprises the bulk of a tooth
dentist,a person qualified to practice dentistry
denture,a dental appliance that artificially replaces missing teeth
deplane,get off an airplane
deplete,use up (resources or materials)
deplore,express strong disapproval of
deplume,"strip of honors, possessions, or attributes"
deposer,a person who testifies or gives a deposition
deposit,the phenomenon of sediment or gravel accumulating
deprave,corrupt morally or by intemperance or sensuality
depress,lower someone's spirits; make downhearted
deprive,take away possessions from someone
derange,"derange mentally, throw out of mental balance; make insane"
derived,reason by deduction; establish by deduction
derrick,a framework erected over an oil well to allow drill tubes to be raised and lowered
dervish,an ascetic Muslim monk; a member of an order noted for devotional exercises involving bodily movements
descale,remove the scales from
descant,a decorative musical accompaniment (often improvised) added above a basic melody
descend,"move downward and lower, but not necessarily all the way"
descent,a movement downward
deserve,be worthy or deserving
desired,feel or have a desire for; want strongly
despair,a state in which all hope is lost or absent
despise,look down on with disdain
despite,lack of respect accompanied by a feeling of intense dislike
despoil,steal goods; take as spoils
despond,lose confidence or hope; become dejected
dessert,a dish served as the last course of a meal
destain,remove stain from (a laboratory specimen) to enhance contrast
destine,decree or designate beforehand
destiny,an event (or a course of events) that will inevitably happen in the future
destroy,"do away with, cause the destruction or undoing of"
deterge,"wipe away; to wash off or out, cleanse; chiefly in medical use: to clear away foul matter from the body"
detract,take away a part from; diminish
detrain,leave a train
deutzia,any of various shrubs of the genus Deutzia having usually toothed opposite leaves and shredding bark and white or pink flowers in loose terminal clusters
devalue,remove the value from; deprive of its value
develop,"make something new, such as a product or a mental or artistic creation"
deviant,a person whose behavior deviates from what is acceptable especially in sexual behavior
deviate,a person whose behavior deviates from what is acceptable especially in sexual behavior
deviled,"cause annoyance in; disturb, especially by minor irritations"
devilry,wicked and cruel behavior
devious,indirect in departing from the accepted or proper way; misleading
devisal,the act of devising something
devisee,someone to whom property (especially realty) is devised by will
deviser,a person who makes plans
devisor,someone who devises real property in a will
devoice,utter with tense vocal chords
devolve,pass on or delegate to another
devoted,"give entirely to a specific person, activity, or cause"
devotee,an ardent follower and admirer
dewdrop,a drop of dew
dextral,of or on the right
dextrin,any of various polysaccharides obtained by hydrolysis of starch; a tasteless and odorless gummy substance that is used as a thickening agent and in adhesives and in dietary supplements
diagram,a drawing intended to explain how something works; a drawing showing the relation between the parts
dialect,the usage or vocabulary that is characteristic of a specific group of people
dialing,operate a dial to select a telephone number
dialyze,separate by dialysis
diamine,any organic compound containing two amino groups
diamond,a transparent piece of diamond that has been cut and polished and is valued as a precious gem
diapsid,reptile having a pair of openings in the skull behind each eye
diarchy,a form of government having two joint rulers
diarist,someone who keeps a diary or journal
dibrach,a metrical unit with unstressed-unstressed syllables
dickens,a word used in exclamations of confusion
dictate,an authoritative rule
diction,the articulation of speech regarded from the point of view of its intelligibility to the audience
dieback,a disease of plants characterized by the gradual dying of the young shoots starting at the tips and progressing to the larger branches
diehard,one who adheres to traditional views
dietary,a regulated daily food allowance
diffuse,move outward
digging,the act of digging
digital,displaying numbers rather than scale positions
dignify,confer dignity or honor upon
dignity,the quality of being worthy of esteem or respect
digraph,two successive letters (especially two letters used to represent a single sound: `sh' in `shoe')
digress,"lose clarity or turn aside especially from the main subject of attention or course of argument in writing, thinking, or speaking"
dilated,become wider
dilater,a surgical instrument that is used to dilate or distend an opening or an organ
dilator,a muscle or nerve that dilates or widens a body part
dilemma,state of uncertainty or perplexity especially as requiring a choice between equally unfavorable options
diluent,a diluting agent
diluted,lessen the strength or flavor of a solution or mixture
diluter,reduced in strength or concentration or quality or purity
dimmest,lacking in light; not bright or harsh
dimness,the state of being poorly illuminated
dinette,a small area off of a kitchen that is used for dining
dingbat,a silly empty-headed person
dingily,in a dingy manner
diocese,the territorial jurisdiction of a bishop
dionaea,a genus of the family Droseraceae
diopter,a unit of measurement of the refractive power of a lens which is equal to the reciprocal of the focal length measured in meters; used by oculists
diorama,a picture (or series of pictures) representing a continuous scene
diorite,a granular crystalline intrusive rock
dioxide,an oxide containing two atoms of oxygen in the molecule
diploid,"(genetics) an organism or cell having the normal amount of DNA per cell; i.e., two sets of chromosomes or twice the haploid number"
diploma,a document certifying the successful completion of a course of study
dipolar,having equal and opposite electric charges or magnetic poles having opposite signs and separated by a small distance
dipping,"immerse briefly into a liquid so as to wet, coat, or saturate"
diptera,a large order of insects having a single pair of wings and sucking or piercing mouths; includes true flies and mosquitoes and gnats and crane flies
diptych,a painting or carving (especially an altarpiece) on two panels (usually hinged like a book)
dipylon,a gateway to the west of ancient Athens near which a distinctive style of pottery has been found
direful,causing fear or dread or terror
dirtily,in a sordid manner
disable,make unable to perform a certain action
disavow,"refuse to acknowledge; disclaim knowledge of; responsibility for, or association with"
disband,cause to break up or cease to function
discard,anything that is cast aside or discarded
discase,get undressed
discern,detect with the senses
discerp,divide into pieces
discina,any fungus of the genus Discina
discoid,having a flat circular shape
discord,lack of agreement or harmony
discuss,an athletic competition in which a disk-shaped object is thrown as far as possible
disdain,lack of respect accompanied by a feeling of intense dislike
disease,an impairment of health or a condition of abnormal functioning
disgust,strong feelings of dislike
dishful,the quantity that a dish will hold
dishpan,large pan for washing dishes
dishrag,a cloth for washing dishes
disjoin,"make disjoint, separated, or disconnected; undo the joining of"
dislike,an inclination to withhold approval from some person or group
dismiss,bar from attention or consideration
disobey,refuse to go along with; refuse to follow; be disobedient
display,something intended to communicate a particular impression
disport,"occupy in an agreeable, entertaining or pleasant fashion"
dispose,"give, sell, or transfer to another"
dispute,a disagreement or argument about something important
disrobe,get undressed
disrupt,make a break in
dissect,cut open or cut apart
dissent,(law) the difference of one judge's opinion from that of the majority
distaff,the sphere of work by women
distant,separated in space or coming from or going to a distance
distend,become wider
distich,two items of the same kind
distill,"remove impurities from, increase the concentration of, and separate through the process of distillation"
distort,make false by mutilation or addition; as of a message or story
disturb,move deeply
dittany,Eurasian perennial herb with white flowers that emit flammable vapor in hot weather
diurnal,of or belonging to or active during the day
diverge,move or draw apart
diverse,many and different
divided,separate into parts or portions
divider,a taxonomist who classifies organisms into many groups on the basis of relatively minor characteristics
diviner,someone who claims to discover hidden knowledge with the aid of supernatural powers
divisor,one of two or more integers that can be exactly divided into another integer
divorce,the legal dissolution of a marriage
divulge,make known to the public information that was previously known only to a few people or that was meant to be kept a secret
dizzily,in a giddy light-headed manner
dockage,a fee charged for a vessel to use a dock
doddery,mentally or physically infirm with age
doeskin,soft leather from deerskin or lambskin
dogbane,any of several poisonous perennial plants of the genus Apocynum having acrid milky juice and bell-shaped white or pink flowers and a very bitter root
dogcart,a cart drawn by a dog
dogfish,primitive long-bodied carnivorous freshwater fish with a very long dorsal fin; found in sluggish waters of North America
doglike,resembling a dog; especially in devotion
dogmata,a religious doctrine that is proclaimed as true without proof
dogtrot,a steady trot like that of a dog
dogwood,a tree of shrub of the genus Cornus often having showy bracts resembling flowers
doleful,filled with or evoking sadness
dolphin,large slender food and game fish widely distributed in warm seas (especially around Hawaii)
doltish,heavy and dull and stupid
dombeya,any of various shrubs or small trees of the genus Dombeya grown for their rounded clusters of exquisite often sweet-scented flowers usually hanging beneath the leaves
dominic,(Roman Catholic Church) Spanish priest who founded an order whose members became known as Dominicans or Black Friars (circa 1170-1221)
dominie,a clergyman; especially a settled minister or parson
dominus,a clergyman; especially a settled minister or parson
donated,give to a charity or good cause
donnish,marked by a narrow focus on or display of learning especially its trivial aspects
doorman,someone who guards an entrance
doorway,the entrance (the space in a wall) through which you enter or leave a room or building; the space that a door can close
doppler,Austrian physicist famous for his discovery of the Doppler effect (1803-1853)
dorking,an English breed of large domestic fowl having five toes (the hind toe doubled)
dormant,in a condition of biological rest or suspended animation
dossier,a collection of papers containing detailed information about a particular person or subject (usually a person's record)
dottily,in a mildly insane manner
dotting,scatter or intersperse like dots or studs
doubled,increase twofold
doubler,an electronic device that doubles the voltage or the frequency of an input signal
doublet,a man's close-fitting jacket; worn during the Renaissance
doubter,someone who habitually doubts accepted beliefs
douglas,United States politician who proposed that individual territories be allowed to decide whether they would have slavery; he engaged in a famous series of debates with Abraham Lincoln (1813-1861)
dovekie,small short-billed auk abundant in Arctic regions
dowager,a widow holding property received from her deceased husband
dowdily,in a dowdy unfashionable manner
downing,United States landscape architect who designed the grounds of the White House and the Capitol Building (1815-1852)
dozener,denoting a quantity consisting of 12 items or units
drachma,a unit of apothecary weight equal to an eighth of an ounce or to 60 grains
draftee,someone who is drafted into military service
drafter,a writer of a draft
dragged,"pull, as against a resistance"
dragger,someone who pulls or tugs or drags in an effort to move something
draggle,"make wet and dirty, as from rain"
dragnet,a system of coordinated measures for apprehending (criminals or other individuals)
dragoon,a member of a European military unit formerly composed of heavily armed cavalrymen
drained,flow off gradually
drapery,hanging cloth used as a blind (especially for a window)
drastic,forceful and extreme and rigorous
draught,a serving of drink (usually alcoholic) drawn from a keg
drawbar,a strong metal bar bearing a hook to attach something to be pulled
drawers,underpants worn by men
drawing,"an illustration that is drawn by hand and published in a book, magazine, or newspaper"
drawler,someone who speaks with a drawl
dreader,causing fear or dread or terror
dreamer,someone who is dreaming
dredger,a barge (or a vessel resembling a barge) that is used for dredging
dressed,put on clothes
dresser,furniture with drawers for keeping clothes
dribble,flowing in drops; the formation and falling of drops of liquid
driblet,a small indefinite quantity (especially of a liquid); ; ; ; --Kipling
drifter,a wanderer who has no established residence or visible means of support
drinker,a person who drinks liquids
driving,hitting a golf ball off of a tee with a driver
drizzle,very light rain; stronger than mist but less than a shower
drizzly,wet with light rain
droplet,a tiny drop
dropout,someone who quits school before graduation
dropper,pipet consisting of a small tube with a vacuum bulb at one end for drawing liquid in and releasing it a drop at a time
drosera,the type genus of Droseraceae including many low bog-inhabiting insectivorous plants
droshky,an open horse-drawn carriage with four wheels; formerly used in Poland and Russia
drought,a shortage of rainfall
drugget,a rug made of a coarse fabric having a cotton warp and a wool filling
drumlin,a mound of glacial drift
drummer,someone who plays a drum
drunken,given to or marked by the consumption of alcohol
dryness,the condition of not containing or being covered by a liquid (especially water)
