word,definition
lacepod,annual herb having pinnatifid basal leaves and slender racemes of small white flowers followed by one-seeded winged silicles
lacerta,type genus of the Lacertidae
laconic,brief and to the point; effectively cut short
lacquer,a black resinous substance obtained from certain trees and used as a natural varnish
lactase,any of a group of enzymes (trade name Lactaid) that hydrolyze lactose to glucose and galactose
lactate,a salt or ester of lactic acid
lacteal,any of the lymphatic vessels that convey chyle from the small intestine to the thoracic duct
lactose,a sugar comprising one glucose molecule linked to a galactose molecule; occurs only in milk
lactuca,an herb with milky juice: lettuce; prickly lettuce
lacunae,a blank gap or missing part
ladanum,a soft blackish-brown resinous exudate from various rockroses used in perfumes especially as a fixative
ladybug,small round bright-colored and spotted beetle that usually feeds on aphids and other insect pests
laggard,someone who takes more time than necessary; someone who lags behind
lagging,used to wrap around pipes or boilers or laid in attics to prevent loss of heat
lagopus,ptarmigans
laicize,reduce to lay status
lakshmi,Hindu goddess of fortune and prosperity
lamaism,a Buddhist doctrine that includes elements from India that are not Buddhist and elements of preexisting shamanism
lamaist,(Buddhism) an adherent of Lamaism
lambent,softly bright or radiant
lambert,a cgs unit of illumination equal to the brightness of a perfectly diffusing surface that emits or reflects one lumen per square centimeter
lambkin,a very young lamb
lamella,any of the radiating leaflike spore-producing structures on the underside of the cap of a mushroom or similar fungus
laminae,a thin plate or layer (especially of bone or mineral)
laminar,arranged in or consisting of laminae
lamplit,lighted by a lamp
lampoon,"a composition that imitates or misrepresents somebody's style, usually in a humorous way"
lamprey,primitive eellike freshwater or anadromous cyclostome having round sucking mouth with a rasping tongue
landing,an intermediate platform in a staircase
landman,a person who lives and works on land
langsat,East Indian tree bearing an edible yellow berry
languid,lacking spirit or liveliness
languor,a relaxed comfortable feeling
laniary,of or relating to a pointed conical tooth
lanolin,a yellow viscous animal oil extracted from wool; a mixture of fatty acids and esters; used in some ointments and cosmetics
lantana,a flowering shrub
lantern,light in a transparent protective case
lanyard,a cord with an attached hook that is used to fire certain types of cannon
laotian,a member of a Buddhist people inhabiting the area of the Mekong River in Laos and Thailand and speaking the Lao language; related to the Thais
lapland,a region in northmost Europe inhabited by Lapps
lapping,covering with a design in which one element covers a part of another (as with tiles or shingles)
lappish,any of the languages spoken by the Lapps and generally assumed to be Uralic languages
lappula,stickweed; beggar's lice
lapsing,a failure to maintain a higher state
laputan,relating to or characteristic of the imaginary country of Laputa or its people
lapwing,large crested Old World plover having wattles and spurs
laramie,a university town in southeast Wyoming
larceny,the act of taking something from someone unlawfully
largely,in large part; mainly or chiefly
largess,a gift or money given (as for service or out of benevolence); usually given ostentatiously
largish,somewhat large
laridae,gull family: gulls and terns
larking,play boisterously
lasting,persist for a specified period of time
latakia,aromatic Turkish tobacco
latchet,a leather strap or thong used to attach a sandal or shoe to the foot
latency,(computer science) the time it takes for a specific block of data on a data track to rotate around to the read/write head
lateral,a pass to a receiver upfield from the passer
lateran,the site in Rome containing the church of Rome and the Lateran Palace
lathery,resembling lather or covered with lather
latices,a milky exudate from certain plants that coagulates on exposure to air
latiner,of or relating to the ancient Latins or the Latin language
latrine,a public toilet in a military area
latrobe,United States architect (born in England) whose works include the chambers of the United States Congress and the Supreme Court; considered the first professional architect in the United States (1764-1820)
lattice,an arrangement of points or particles or objects in a regular periodic pattern in 2 or 3 dimensions
latvian,a native or inhabitant of Latvia
laugher,a person who is laughing or who laughs easily
launder,"cleanse with a cleaning agent, such as soap, and water"
laundry,garments or white goods that can be cleaned by laundering
lawless,without law or control
lawsuit,a comprehensive term for any proceeding in a court of law whereby an individual seeks a legal remedy
laxness,the quality of being lax and neglectful
layered,make or form a layer
layette,kit consisting of a complete outfit (clothing and accessories) for a new baby
layover,a brief stay in the course of a journey
lazaret,hospital for persons with infectious diseases (especially leprosy)
lazarus,the person who Jesus raised from the dead after four days in the tomb; this miracle caused the enemies of Jesus to begin the plan to put him to death
leading,thin strip of metal used to separate lines of type in printing
leafage,the main organ of photosynthesis and transpiration in higher plants
leaflet,a thin triangular flap of a heart valve
leakage,the discharge of a fluid from some container
leander,(Greek mythology) a youth beloved of Hero who drowned in a storm in the Hellespont on one of his nightly visits to see her
leaning,an inclination to do something
leaping,"a light, self-propelled movement upwards or forwards"
learned,gain knowledge or skills
learner,someone (especially a child) who learns (as from a teacher) or takes up knowledge or beliefs
leasing,let for money
leather,an animal skin made smooth and flexible by removing the hair and then tanning
leaving,the act of departing
lechery,unrestrained indulgence in sexual activity
lectern,desk or stand with a slanted top used to hold a text at the proper height for a lecturer
lecture,a speech that is open to the public
leeches,carnivorous or bloodsucking aquatic or terrestrial worms typically having a sucker at each end
leeward,the direction in which the wind is blowing
leftish,tending toward the political left
leftism,the ideology of the political left; belief in or support of the tenets of the political left
leftist,a person who belongs to the political left
legally,by law; conforming to the law
legatee,someone to whom a legacy is bequeathed
legging,a garment covering the leg (usually extending from the knee to the ankle)
leghorn,a stiff hat made of straw with a flat crown
legible,"(of handwriting, print, etc.) capable of being read or deciphered"
legibly,in a legible manner
legless,not having legs
leglike,resembling or functioning like a leg
leister,a spear with three or more prongs; used for spearing fish (especially salmon)
leisure,time available for ease and relaxation
lemmata,a subsidiary proposition that is assumed to be true in order to prove another proposition
lemming,any of various short-tailed furry-footed rodents of circumpolar distribution
lempira,the basic unit of money in Honduras; equal to 100 centavos
lengthy,relatively long in duration; tediously protracted
lenient,tolerant or lenient
lentigo,a small brownish spot (of the pigment melanin) on the skin
lentisk,an evergreen shrub of the Mediterranean region that is cultivated for its resin
leonard,United States writer of thrillers (born in 1925)
leonine,of or characteristic of or resembling a lion
leopard,the pelt of a leopard
leotard,a tight-fitting garment of stretchy material that covers the body from the shoulders to the thighs (and may have long sleeves or legs reaching down to the ankles); worn by ballet dancers and acrobats for practice or performance
lepanto,Turkish sea power was destroyed in 1571 by a league of Christian nations organized by the Pope
lepiota,any fungus of the genus Lepiota
lepisma,type genus of the Lepismatidae: silverfish
lepomis,bream
leporid,rabbits and hares
leprose,rough to the touch; covered with scales or scurf
leprosy,chronic granulomatous communicable disease occurring in tropical and subtropical regions; characterized by inflamed nodules beneath the skin and wasting of body parts; caused by the bacillus Mycobacterium leprae
leprous,relating to or resembling or having leprosy
lesbian,a female homosexual
letdown,a feeling of dissatisfaction that results when your expectations are not realized
lettish,the official language of Latvia; belongs to the Baltic branch of Indo-European
lettuce,informal terms for money
leucine,a white crystalline amino acid occurring in proteins that is essential for nutrition; obtained by the hydrolysis of most dietary proteins
leucoma,eye disease consisting of an opaque white spot on the cornea
levator,a muscle that serves to lift some body part (as the eyelid or lip)
leveler,a radical who advocates the abolition of social distinctions
leveret,a young hare especially one in its first year
lewisia,genus of western North American low-growing herbs having linear woolly leaves and large pink flowers
lexical,of or relating to words
lexicon,a language user's knowledge of words
liaison,a usually secretive or illicit sexual relationship
liatris,genus of perennial North American herbs with aromatic usually cormous roots
libeler,one who attacks the reputation of another by slander or libel
liberal,a person who favors a political philosophy of progress and reform and the protection of civil liberties
liberia,a republic in West Africa; established in 1822 by Americans as a way to free negro slaves
liberty,immunity from arbitrary exercise of authority: political independence
library,a room where books are kept
librate,determine the weight of
license,a legal document giving official permission to do something
licitly,in a manner acceptable to common custom
licking,an unsuccessful ending to a struggle or contest
lidless,not having or covered with a lid or lids
lifting,raise from a lower to a higher position
liftman,a man employed to operate an elevator
lighten,make more cheerful
lighter,a substance used to ignite or kindle a fire
lightly,without good reason
lignify,convert into wood or cause to become woody
lignite,intermediate between peat and bituminous coal
likable,(of characters in literature or drama) evoking empathic or sympathetic feelings
limbers,a channel or gutter on either side of a ship's keelson; carries bilge water into the pump well
limeade,sweetened beverage of lime juice and water
limited,public transport consisting of a fast train or bus that makes only a few scheduled stops
limiter,(electronics) a nonlinear electronic circuit whose output is limited in amplitude; used to limit the instantaneous amplitude of a waveform (to clip off the peaks of a waveform)
limping,disability of walking due to crippling of the legs or feet
limpkin,"wading bird of Florida, Cuba and Jamaica having a drooping bill and a distinctive wailing call"
limulus,type genus of the family Limulidae
linaria,genus of herbs and subshrubs having showy flowers: spurred snapdragon
lincoln,16th President of the United States; saved the Union during the American Civil War and emancipated the slaves; was assassinated by Booth (1809-1865)
lindane,a white crystalline powder used as an agricultural insecticide
lindera,aromatic evergreen or deciduous dioecious shrubs or trees of eastern Asia and North America
lindsay,United States playwright who collaborated with Russel Crouse on several musicals (1889-1931)
lineage,the descendants of one individual
linecut,a print obtained from a line drawing
lineman,one of the players on the line of scrimmage
lingual,a consonant that is produced with the tongue and other speech organs
linkage,an associative relation
linkboy,(formerly) an attendant hired to carry a torch for pedestrians in dark streets
linking,make a logical or causal connection
linkman,(formerly) an attendant hired to carry a torch for pedestrians in dark streets
linnaea,one species: twinflower
linseed,the seed of flax used as a source of oil
lioness,a female lion
lionize,assign great social importance to
liparis,an orchid of the genus Liparis having few leaves and usually fairly small yellow-green or dull purple flowers in terminal racemes
lipemia,presence of excess lipids in the blood
lipless,without a lip or lips
liplike,having lips or parts that resemble lips
liquefy,become liquid
liqueur,strong highly flavored sweet liquor usually drunk after a meal
lissome,moving and bending with ease
listera,genus of terrestrial orchids having usually a single pair of broad shining leaves near the middle of the stem; found in temperate Asia and North America and Europe
listing,a database containing an ordered array of items (names or topics)
literal,a mistake in printed matter resulting from mechanical failures of some kind
lithium,a soft silver-white univalent element of the alkali metal group; the lightest metal known; occurs in several minerals
litotes,understatement for rhetorical effect (especially when expressing an affirmative by negating its contrary)
liturgy,a Christian sacrament commemorating the Last Supper by consecrating bread and wine
livable,fit or suitable to live in or with
lividly,in a livid manner
loading,weight to be borne or conveyed
loafing,having no employment
loather,one who hates or loathes
loathly,highly offensive; arousing aversion or disgust
lobated,having or resembling a lobe or lobes
lobelia,any plant or flower of the genus Lobelia
lobster,flesh of a lobster
lobular,of or relating to or resembling a lobule
lobworm,marine worms having a row of tufted gills along each side of the back; often used for fishing bait
locally,by a particular locality
locator,a person who fixes the boundaries of land claims
lockage,a fee charged for passage through a lock in a canal or waterway
lockbox,a fireproof metal strongbox (usually in a bank) for storing valuables
locking,the act of locking something up to protect it
lockjaw,an acute and serious infection of the central nervous system caused by bacterial infection of open wounds; spasms of the jaw and laryngeal muscles may occur during the late stages
lockman,a worker in charge of a lock (on a canal)
lockout,a management action resisting employee's demands; employees are barred from entering the workplace until they agree to terms
locoism,a disease of livestock caused by locoweed poisoning; characterized by weakness and lack of coordination and trembling and partial paralysis
loculus,a small cavity or space within an organ or in a plant or animal
locusta,a genus of Acrididae
lodging,structures collectively in which people are housed
loftily,in a lofty manner
lofting,store in a loft
logania,type genus of the Loganiaceae; Australian and New Zealand shrubs sometimes cultivated for their flowers
logbook,a book in which the log is written
logging,the work of cutting down trees for timber
logical,capable of or reflecting the capability for correct and valid reasoning
logroll,work toward the passage of some legislation by exchanging political favors such as trading votes
logwood,very hard brown to brownish-red heartwood of a logwood tree; used in preparing a purplish red dye
lombard,a member of a Germanic people who invaded northern Italy in the 6th century
longbow,a powerful wooden bow drawn by hand; usually 5-6 feet long; used in medieval England
longing,prolonged unfulfilled desire or need
longish,somewhat long
looking,the act of directing the eyes toward something and perceiving it visually
lookout,a person employed to keep watch for some anticipated event
looming,"come into view indistinctly, often threateningly"
looping,(computer science) executing the same set of instructions a given number of times or until a specified result is obtained
loosely,in a relaxed manner; not rigid
loosing,grant freedom to; free from confinement
lopping,cut off from a whole
lording,make a lord of someone
lottery,something that is regarded as a chance event
lounger,someone who wastes time
loutish,ill-mannered and coarse and contemptible in behavior or appearance
lovable,having characteristics that attract love or affection
loverly,like or in the manner of a lover
lowborn,of humble birth or origins
lowbred,(of persons) lacking in refinement or grace
lowland,low level country
lowness,a position of inferior status; low in station or rank or fortune or estimation
loyally,with loyalty; in a loyal manner
loyalty,the quality of being loyal
lozenge,a small aromatic or medicated candy
lucania,a region of southern Italy (forming the instep of the Italian `boot')
lucerne,important European leguminous forage plant with trifoliate leaves and blue-violet flowers grown widely as a pasture and hay crop
lucidly,in a clear and lucid manner
lucifer,(Judeo-Christian and Islamic religions) chief spirit of evil and adversary of God; tempter of mankind; master of Hell
lucilia,greenbottle flies
luckily,by good fortune
lucknow,a city in northern India in Uttar Pradesh; during the Indian Mutiny its British residents were besieged by Indian insurgents
luddite,any opponent of technological progress
luganda,the Bantu language of the Buganda people; spoken in Uganda
luggage,cases used to carry belongings when traveling
lugsail,a sail with four corners that is hoisted from a yard that is oblique to the mast
lugworm,marine worms having a row of tufted gills along each side of the back; often used for fishing bait
lullaby,a quiet song intended to lull a child to sleep
lumbago,backache affecting the lumbar region or lower back; can be caused by muscle strain or arthritis or vascular insufficiency or a ruptured intervertebral disc
luminal,a long-acting barbiturate used as a sedative
lumping,put together indiscriminately
lumpish,mentally sluggish
lunaria,small genus of European herbs: honesty
lunatic,an insane person
luncher,someone who is eating lunch
lunette,temporary fortification like a detached bastion
lupinus,herbs or shrubs: lupin
lurcher,someone waiting in concealment
luridly,in a lurid manner
lustful,characterized by lust
lustily,in a healthy manner
lustrum,a period of five years
lutfisk,dried cod soaked in a lye solution before boiling to give it a gelatinous consistency
luthier,a craftsman who makes stringed instruments (as lutes or guitars or violins)
lycaena,type genus of the Lycaenidae; small slender butterflies with upper surface of wings usually metallic blue or green or copper
lychnis,mostly perennial herbs with sticky stems that catch insects; widespread in north temperate zone
lycopod,primitive evergreen moss-like plant with spores in club-shaped strobiles
lycopus,small genus of herbs of the mint family
lygaeid,a true bug: usually bright-colored; pest of cultivated crops and some fruit trees
lyrical,suitable for or suggestive of singing
lyrurus,black grouse
lythrum,loosestrife
macabre,shockingly repellent; inspiring horror
macadam,broken stone used in macadamized roadways
macaque,short-tailed monkey of rocky regions of Asia and Africa
macbeth,king of Scotland (died in 1057)
macedon,the ancient kingdom of Philip II and Alexander the Great in the southeastern Balkans that is now divided among modern Macedonia and Greece and Bulgaria
machete,a large heavy knife used in Central and South America as a weapon or for cutting vegetation
machine,any mechanical or electrical device that transmits or modifies energy to perform or assist in the performance of human tasks
maclura,yellowwood trees or shrubs
macrame,a relatively coarse lace; made by weaving and knotting cords
madeira,a Brazilian river; tributary of the Amazon River
madness,obsolete terms for legal insanity
madonna,the mother of Jesus; Christians refer to her as the Virgin Mary; she is especially honored by Roman Catholics
madoqua,genus comprising some small antelopes of eastern and northeastern Africa
madrona,evergreen tree of the Pacific coast of North America having glossy leathery leaves and orange-red edible berries; wood used for furniture and bark for tanning
madwort,any garden plant of the genus Alyssum having clusters of small yellow or white flowers
maestri,an artist of consummate skill
maestro,an artist of consummate skill
magenta,"a primary subtractive color for light; a dark purple-red color; the dye for magenta was discovered in 1859, the year of the battle of Magenta"
maggoty,spoiled and covered with eggs and larvae of flies
magical,possessing or using or characteristic of or appropriate to supernatural powers; ; ; ; - Shakespeare
magnate,a very wealthy or powerful businessman
magneto,a small dynamo with a secondary winding that produces a high voltage enabling a spark to jump between the poles of a spark plug in a gasoline engine
magnify,"increase in size, volume or significance"
mahatma,(Hinduism) term of respect for a brahmin sage
mahdism,belief in the appearance of the Mahdi; devotion to a Mahdi
mahdist,an adherent of Mahdism
mahican,a member of the Algonquian people formerly living in the Hudson valley and eastward to the Housatonic
mahomet,"the Arab prophet who, according to Islam, was the last messenger of Allah (570-632)"
mahonia,evergreen shrubs and small trees of North and Central America and Asia
mahound,"the Arab prophet who, according to Islam, was the last messenger of Allah (570-632)"
mahuang,Chinese ephedra yielding ephedrine
maidism,a disease caused by deficiency of niacin or tryptophan (or by a defect in the metabolic conversion of tryptophan to niacin); characterized by gastrointestinal disturbances and erythema and nervous or mental disorders; may be caused by malnutrition or alcoholism or other nutritional impairments
mailbag,pouch used in the shipment of mail
mailbox,a private box for delivery of mail
mailman,a man who delivers the mail
majagua,shrubby tree widely distributed along tropical shores; yields a light tough wood used for canoe outriggers and a fiber used for cordage and caulk; often cultivated for ornament
majesty,impressiveness in scale or proportion
malacca,stem of the rattan palm used for making canes and umbrella handles
malacia,a state of abnormal softening of tissue
malaise,physical discomfort (as mild sickness or depression)
malanga,tropical American aroid having edible tubers that are cooked and eaten like yams or potatoes
malaria,an infective disease caused by sporozoan parasites that are transmitted through the bite of an infected Anopheles mosquito; marked by paroxysms of chills and fever
malaxis,large genus of largely terrestrial orchids with one or a few plicate leaves and slender spikes or tiny mostly green flowers; cosmopolitan
malayan,a member of a people inhabiting the northern Malay Peninsula and Malaysia and parts of the western Malay Archipelago
maleate,a salt or ester of maleic acid; used as a nontricyclic antidepressant drug for psychomotor activation
mallard,wild dabbling duck from which domestic ducks are descended; widely distributed
malleus,the ossicle attached to the eardrum
malmsey,sweet Madeira wine
malodor,a distinctive odor that is offensively unpleasant
maltese,a native or inhabitant of Malta
malting,treat with malt or malt extract
maltman,a maker of malt
maltose,a white crystalline sugar formed during the digestion of starches
mammary,of or relating to the milk-giving gland of the female
mammoth,any of numerous extinct elephants widely distributed in the Pleistocene; extremely large with hairy coats and long upcurved tusks
manacle,shackle that consists of a metal loop that can be locked around the wrist; usually used in pairs
manager,someone who controls resources and expenditures
manakin,a woman who wears clothes to display fashions
manatee,sirenian mammal of tropical coastal waters of America; the flat tail is rounded
mandala,any of various geometric designs (usually circular) symbolizing the universe; used chiefly in Hinduism and Buddhism as an aid to meditation
mandate,a document giving an official instruction or command
mandola,an early type of mandolin
mandrel,any of various rotating shafts that serve as axes for larger rotating parts
mangily,in a mangy manner
mangler,a person who mutilates or destroys or disfigures or cripples
manhole,a hole (usually with a flush cover) through which a person can gain access to an underground structure
manhood,the state of being a man; manly qualities
manidae,coextensive with the order Pholidota
manihot,genus of economically important tropical plants: cassava
manikin,a person who is very small but who is not otherwise deformed or abnormal
manilla,a strong paper or thin cardboard with a smooth light brown finish made from e.g. Manila hemp
mankind,all of the living human inhabitants of the earth
manlike,possessing qualities befitting a man
manners,social deportment
manning,take charge of a certain job; occupy a certain work place
mannish,resembling or imitative of or suggestive of a man rather than a woman
manroot,tropical American prostrate or climbing herbaceous perennial having an enormous starchy root; sometimes held to be source of the sweet potato
mansard,a hip roof having two slopes on each side
mansion,(astrology) one of 12 equal areas into which the zodiac is divided
mantled,"spread over a surface, like a mantle"
mantlet,portable bulletproof shelter
mantrap,a very attractive or seductive looking woman
manumit,free from slavery or servitude
marabou,large African black-and-white carrion-eating stork; its downy underwing feathers are used to trim garments
maranta,any of numerous herbs of the genus Maranta having tuberous starchy roots and large sheathing leaves
marasca,small bitter fruit of the marasca cherry tree from whose juice maraschino liqueur is made
