word,definition
relaxer,any agent that produces relaxation
relearn,"learn something again, as after having forgotten or neglected it"
release,merchandise issued for sale or public showing (especially a record or film)
reliant,relying on another for support
relieve,"provide physical relief, as from pain"
relievo,sculpture consisting of shapes carved on a surface so as to stand out from the surrounding background
remains,any object that is left unused or still extant
remarry,"marry, not for the first time"
rematch,something (especially a game) that is played again
remnant,a small part or portion that remains after the main part no longer exists
remodel,"do over, as of (part of) a house"
remorse,a feeling of deep regret (usually for some misdeed)
remould,cast again
remount,a fresh horse especially (formerly) to replace one killed or injured in battle
removal,the act of removing
removed,"remove something concrete, as by lifting, pushing, or taking off, or remove something abstract"
remover,a solvent that removes a substance (usually from a surface)
renewal,the conversion of wasteland into land suitable for use of habitation or cultivation
reorder,a repeated order for the same merchandise
repaint,paint again
replace,substitute a person or thing for (another that is broken or inefficient or lost or no longer working or yielding what is expected)
replant,plant again or anew
replete,fill to satisfaction
replica,copy that is not the original; something that has been copied
repoint,repair the joints of bricks
reposed,put or confide something in a person or thing
reposit,put (something) in a place for storage
repress,put down by force or intimidation
reprint,a publication (such as a book) that is reprinted without changes or editing and offered again for sale
reprise,repeat an earlier theme of a composition
reproof,an act or expression of criticism and censure
reprove,take to task
reptile,"any cold-blooded vertebrate of the class Reptilia including tortoises, turtles, snakes, lizards, alligators, crocodiles, and extinct forms"
repulse,an instance of driving away or warding off
reputed,look on as or consider
request,a formal message requesting something that is submitted to an authority
requiem,a song or hymn of mourning composed or performed as a memorial to a dead person
require,"require as useful, just, or proper"
requite,make repayment for or return something
reredos,a painted or carved screen placed above and behind an altar or communion table
rescind,cancel officially
rescuer,a person who rescues you from harm or danger
reserve,formality and propriety of manner
reshape,shape anew or differently
reshoot,shoot again
residua,something left after other parts have been taken away
residue,matter that remains after something has been removed
resolve,the trait of being resolute
resound,ring or echo with sound
respect,(usually preceded by `in') a detail or point
respire,"breathe easily again, as after exertion or anxiety"
respite,a (temporary) relief from harm or discomfort
respond,show a response or a reaction to something
restart,"start an engine again, for example"
restate,"to say, state, or perform again"
restful,affording physical or mental rest
resting,not move; be in a resting position
restive,being in a tense state
restock,stock again
restore,return to its original or usable and functioning condition
resurge,rise again
rethink,thinking again about a choice previously made
reticle,"a network of fine lines, dots, cross hairs, or wires in the focal plane of the eyepiece of an optical instrument"
retinal,either of two yellow to red retinal pigments formed from rhodopsin by the action of light
retinol,an unsaturated alcohol that occurs in marine fish-liver oils and is synthesized biologically from carotene
retinue,the group following and attending to some important person
retired,go into retirement; stop performing one's work or withdraw from one's position
retouch,give retouches to (hair)
retrace,to go back over again
retract,"formally reject or disavow a formerly held belief, usually under pressure"
retrain,teach new skills
retread,a used automobile tire that has been remolded to give it new treads
retreat,(military) withdrawal of troops to a more favorable position to escape the enemy's superior forces or after a defeat
retrial,a new trial in which issues already litigated and to which the court has already rendered a verdict or decision are reexamined by the same court; occurs when the initial trial is found to have been improper or unfair due to procedural errors
retting,"place (flax, hemp, or jute) in liquid so as to promote loosening of the fibers from the woody tissue"
reunify,"unify again, as of a country"
reunion,a party of former associates who have come together again
reunite,have a reunion; unite again
revalue,gain in value
reveler,a celebrant who shares in a noisy party
revelry,unrestrained merrymaking
revenge,action taken in return for an injury or offense
revenue,the entire amount of income before any deductions are made
revered,love unquestioningly and uncritically or to excess; venerate as an idol
reverie,absentminded dreaming while awake
reverse,a relation of direct opposition
revisal,the act of rewriting something
revised,make revisions in
reviser,someone who puts text into appropriate form for publication
revisit,visit again
revival,bringing again into activity and prominence
revolve,turn on or around an axis or a center
rewrite,something that has been written again
reynard,a conventional name for a fox used in tales following usage in the old epic `Reynard the Fox'
rhamnus,type genus of the Rhamnaceae: buckthorns
rheidae,a family of birds coextensive with the order Rheiformes
rhenish,any of several white wines from the Rhine River valley in Germany (`hock' is British usage)
rhenium,a rare heavy polyvalent metallic element that resembles manganese chemically and is used in some alloys; is obtained as a by-product in refining molybdenum
rhinion,the anterior tip at the end of the suture of the nasal bones
rhizoid,any of various slender filaments that function as roots in mosses and ferns and fungi etc
rhizome,a horizontal plant stem with shoots above and roots below serving as a reproductive structure
rhodium,a white hard metallic element that is one of the platinum group and is found in platinum ores; used in alloys with platinum
rhombic,resembling a rhombus
rhombus,a parallelogram with four equal sides; an oblique-angled equilateral parallelogram
rhubarb,long pinkish sour leafstalks usually eaten cooked and sweetened
ribband,a ribbon used as a decoration
ribbing,a framework of ribs
ribbony,long and thin; resembling a ribbon
ribless,having no ribs or no visible ribs
riblike,resembling a rib
ribwort,an Old World plantain with long narrow ribbed leaves widely established in temperate regions
ricardo,English economist who argued that the laws of supply and demand should operate in a free market (1772-1823)
ricinus,a genus of herb having only one known species: castor-oil plant
rickets,childhood disease caused by deficiency of vitamin D and sunlight associated with impaired metabolism of calcium and phosphorus
rickety,inclined to shake as from weakness or defect
ricksha,a small two-wheeled cart for one passenger; pulled by one person
ridding,relieve from
ridging,extend in ridges
riffian,a Berber living in northern Morocco
rifling,the cutting of spiral grooves on the inside of the barrel of a firearm
rigging,gear consisting of ropes etc. supporting a ship's masts and sails
righter,being or located on or directed toward the side of the body to the east when facing north
rightly,with honesty
rigidly,in a rigid manner
riksmal,in 1929 this dialect of Norwegian was officially renamed Bokmal
rimless,lacking a rim or frame
ringing,the sound of a bell ringing; ; ; --E. A. Poe
ringlet,a round shape formed by a series of concentric circles (as formed by leaves or flower petals)
rinsing,the removal of soap with clean water in the final stage of washing
rioting,a state of disorder involving group violence
riotous,produced or growing in extreme abundance
ripcord,a cord that is pulled to open the gasbag of a balloon wide enough to release gas and so causes the balloon to descend
riposte,a quick reply to a question or remark (especially a witty or critical one)
ripping,tear or be torn violently
risible,arousing or provoking laughter
riskily,in a dangerously risky manner
rivalry,the act of competing as for profit or a prize
riveter,a worker who inserts and hammers rivets
rivulet,a small stream
roadbed,a bed supporting a road
roadman,a salesman who travels to call on customers
roadway,a road (especially that part of a road) over which vehicles travel
roaming,"move about aimlessly or without any destination, often in search of food or employment"
roanoke,a city in southwestern Virginia
roaring,a deep prolonged loud noise
roaster,a harsh or humorous critic (sometimes intended as a facetious compliment)
robbery,larceny by threat of violence
robbing,take something away by force or without the consent of the owner
robinia,deciduous flowering trees and shrubs
rockery,a garden featuring rocks; usually alpine plants
rockies,the chief mountain range of western North America; extends from British Columbia to northern New Mexico; forms the continental divide
rocking,move back and forth or sideways
rodlike,resembling a rod
roebuck,male roe deer
roguery,reckless or malicious behavior that causes discomfort or annoyance in others
roguish,playful in an appealingly bold way
roister,"engage in boisterous, drunken merrymaking"
rollick,play boisterously
rolling,a deep prolonged sound (as of thunder or large bells)
romaine,lettuce with long dark-green leaves in a loosely packed elongated head
romance,a relationship between two lovers
romanic,of or relating to or derived from Rome (especially ancient Rome)
romansh,the Rhaeto-Romance language spoken in southeastern Switzerland; it is an official language of Switzerland
rommany,"a member of a people with dark skin and hair who speak Romany and who traditionally live by seasonal work and fortunetelling; they are believed to have originated in northern India but now are living on all continents (but mostly in Europe, North Africa, and North America)"
romneya,one species: matilija poppy
romping,play boisterously
romulus,(Roman mythology) founder of Rome; suckled with his twin brother Remus by a wolf after their parents (Mars and Rhea Silvia) abandoned them; Romulus killed Remus in an argument over the building of Rome
rondeau,a musical form that is often the last movement of a sonata
rontgen,German physicist who discovered x-rays and developed roentgenography (1845-1923)
roofing,material used to construct a roof
rookery,a breeding ground for gregarious birds (such as rooks)
roomful,the quantity a room will hold
roomily,with ample room
roosted,"sit, as on a branch"
rooster,adult male chicken
rootage,fixedness by or as if by roots
rootlet,small root or division of a root
ropeway,a conveyance that transports passengers or freight in carriers suspended from cables and supported by a series of towers
rorippa,annual and perennial herbs of damp habitats; cosmopolitan except Antarctica
rorqual,any of several baleen whales of the family Balaenopteridae having longitudinal grooves on the throat and a small pointed dorsal fin
rosales,in some classifications this category does not include Leguminosae
rosario,a port city on the Parana River in eastern central Argentina
roseate,of something having a dusty purplish pink color
rosebay,late-spring-blooming rhododendron of eastern North America having rosy to pink-purple flowers
rosebud,the bud of a rose
roselle,East Indian sparsely prickly annual herb or perennial subshrub widely cultivated for its fleshy calyxes used in tarts and jelly and for its bast fiber
roseola,any red eruption of the skin
rosette,an ornament or pattern resembling a rose that is worn as a badge of office or as recognition of having won an honor
rosilla,a sneezeweed of southwestern United States especially southern California
rostrum,a platform raised above the surrounding level to give prominence to the person on it
rotated,turn on or around an axis or a center
rotifer,minute aquatic multicellular organisms having a ciliated wheel-like organ for feeding and locomotion; constituents of freshwater plankton
rotting,(biology) the process of decay caused by bacterial or fungal action
rotunda,a building having a circular plan and a dome
roughen,make rough or rougher
rougher,having or caused by an irregular surface
roughly,(of quantities) imprecise but fairly close to correct
roulade,a dish consisting of a slice of meat that is rolled around a filling and cooked
rouleau,a roll of ribbon
rounded,wind around; move along a circular course
roundel,English form of rondeau having three triplets with a refrain after the first and third
rounder,a dissolute person; usually a man who is morally unrestrained
roundly,in a round manner
roundup,the activity of gathering livestock together so that they can be counted or branded or sold
rousing,the act of arousing
routine,an unvarying or habitual method or procedure
routing,send documents or materials to appropriate destinations
rowboat,a small boat of shallow draft with cross thwarts for seats and rowlocks for oars with which it is propelled
rowdily,in a rowdy manner
rowlock,a holder attached to the gunwale of a boat that holds the oar in place and acts as a fulcrum for rowing
royally,in a royal manner
royalty,payment to the holder of a patent or copyright or resource for the right to use their property
rubbers,an elastic material obtained from the latex sap of trees (especially trees of the genera Hevea and Ficus) that can be vulcanized and finished into a variety of products
rubbery,having an elastic texture resembling rubber in flexibility or toughness
rubbing,the resistance encountered when one body is moved in contact with another
rubbish,worthless material that is to be disposed of
rubdown,"the act of rubbing down, usually for relaxation or medicinal purposes"
rubella,a contagious viral disease that is a milder form of measles lasting three or four days; can be damaging to a fetus during the first trimester
rubeola,an acute and highly contagious viral disease marked by distinct red spots followed by a rash; occurs primarily in children
rubicon,the boundary in ancient times between Italy and Gaul; Caesar's crossing it with his army in 49 BC was an act of war
ruction,the act of making a noisy disturbance
ruffian,a cruel and brutal fellow
ruffled,stir up (water) so as to form ripples
ruinous,extremely harmful; bringing physical or financial ruin
rummage,a jumble of things to be given away
runaway,an easy victory
running,(American football) a play in which a player attempts to carry the ball through or past the opposing team
rupture,state of being torn or burst open
rurally,in a rural manner
rushing,(American football) an attempt to advance the ball by running into the line
russell,United States religious leader who founded the sect that is now called Jehovah's Witnesses (1852-1916)
russian,a native or inhabitant of Russia
russula,large genus of fungi with stout stems and white spores and neither annulus nor volva; brittle caps of red or purple or yellow or green or blue; differs from genus Lactarius in lacking milky juice
rustler,someone who steals livestock (especially cattle)
ruthful,feeling or expressing pain or sorrow for sins or offenses
ruttish,feeling great sexual desire
sabaoth,(plural) hosts or armies; used in the book of Romans in the New Testament
sabbath,a day of rest and worship: Sunday for most Christians; Saturday for the Jews and a few Christians; Friday for Muslims
sabered,cut or injure with a saber
saccade,"a rapid, jerky movement of the eyes between positions of rest"
saccule,a small sac or pouch (especially the smaller chamber of the membranous labyrinth)
sackbut,a medieval musical instrument resembling a trombone
sackful,the quantity contained in a sack
sacking,coarse fabric used for bags or sacks
saclike,shaped like a pouch
saddled,put a saddle on
saddler,a maker and repairer and seller of equipment for horses
sadness,emotions experienced when not in a state of well-being
saffron,Old World crocus having purple or white flowers with aromatic pungent orange stigmas used in flavoring food
sagging,"droop, sink, or settle from or as if from pressure or loss of tautness"
sagitta,a small constellation in the northern hemisphere between Cygnus and Aquila and crossed by the Milky Way
saguaro,extremely large treelike cactus of desert regions of southwestern United States having a thick columnar sparsely branched trunk bearing white flowers and edible red pulpy fruit
saharan,a Nilo-Saharan language spoken in parts of Chad
sailing,the work of a sailor
saimiri,squirrel monkeys
sainted,hold sacred
saintly,marked by utter benignity; resembling or befitting an angel or saint
sakkara,a town in northern Egypt; site of the oldest Egyptian pyramids
saktism,a Hindu sect worshiping Shakti
salable,capable of being sold; fit for sale
salient,(military) the part of the line of battle that projects closest to the enemy
salomon,American financier and American Revolutionary War patriot who helped fund the army during the American Revolution (1740?-1785)
salpinx,a tube in the uterus or the ear
salsify,edible root of the salsify plant
salsola,chiefly Old World herbs or shrubs: saltworts
saltate,move by saltation
saltier,engagingly stimulating or provocative
saltine,a cracker sprinkled with salt before baking
salting,the act of adding salt to food
saltish,somewhat salty
saltpan,a shallow basin in a desert region; contains salt and gypsum that was deposited by an evaporated salt lake
saluter,a person who greets
salvage,property or goods saved from damage or destruction
samaria,an ancient city in central Palestine founded in the 9th century BC as the capital of the northern Hebrew kingdom of Israel; the site is in present-day northwestern Jordan
samhita,one of four collections of sacred texts
samisen,a Japanese stringed instrument resembling a banjo with a long neck and three strings and a fretted fingerboard and a rectangular soundbox; played with a plectrum
samnite,an Oscan-speaking member of an ancient people of Campania who clashed repeatedly with the early Romans
samolus,genus of herbs usually growing in salt marshes: water pimpernels
samovar,a metal urn with a spigot at the base; used in Russia to boil water for tea
samoyed,a Samoyedic-speaking person in northwestern Siberia
sampler,an observation station that is set up to make sample observations of something
samsara,(Hinduism and Buddhism) the endless cycle of birth and suffering and death and rebirth
samurai,a Japanese warrior who was a member of the feudal military aristocracy
sanctum,a place of inviolable privacy
sandbag,a bag filled with sand; used as a weapon or to build walls or as ballast
sandbox,mold consisting of a box with sand shaped to mold metal
sandboy,a young peddler of sand; used now only to express great happiness in `happy as a sandboy'
sandbur,grass of the eastern United States and tropical America having spikelets enclosed in prickly burs
sanders,a power tool used for sanding wood; an endless loop of sandpaper is moved at high speed by an electric motor
sanding,rub with sandpaper
sandman,an elf in fairy stories who sprinkles sand in children's eyes to make them sleepy
sanicle,a plant of the genus Sanicula having palmately compound leaves and unisexual flowers in panicled umbels followed by bristly fruit; reputed to have healing powers
sanious,of or resembling or characterized by ichor or sanies
santimi,100 santimi equal 1 lats in Latvia
santims,100 santimi equal 1 lats in Latvia
saphead,a person who lacks good judgment
sapient,acutely insightful and wise
sapless,lacking bodily or muscular strength or vitality
sapling,young tree
saponin,any of various plant glucosides that form soapy lathers when mixed and agitated with water; used in detergents and foaming agents and emulsifiers
sapphic,a meter used by Sappho and named after her
sapping,deplete
sapsago,a hard green Swiss cheese made with skim-milk curd and flavored with clover
sapwood,newly formed outer wood lying between the cambium and the heartwood of a tree or woody plant; usually light colored; active in water conduction
saracen,(historically) a member of the nomadic people of the Syrian and Arabian deserts at the time of the Roman Empire
sarcasm,witty language used to convey insults or scorn; ; ; --Jonathan Swift
sarcoid,of or relating to or resembling flesh
sarcoma,a usually malignant tumor arising from connective tissue (bone or muscle etc.); one of the four major types of cancer
sardine,small fatty fish usually canned
sardius,a deep orange-red variety of chalcedony
sassaby,a large South African antelope; considered the swiftest hoofed mammal
satanic,extremely evil or cruel; expressive of cruelty or befitting hell
satchel,luggage consisting of a small case with a flat bottom and (usually) a shoulder strap
satiate,fill to satisfaction
satiety,the state of being satisfactorily full and unable to take on more
satiric,exposing human folly to ridicule
satisfy,meet the requirements or expectations of
satsuma,a variety of mandarin orange
satyric,of or relating to or having the characteristics of a satyr
saucily,in an impudent or impertinent manner
saunter,a careless leisurely gait
saurian,any of various reptiles of the suborder Sauria which includes lizards; in former classifications included also the crocodiles and dinosaurs
sausage,highly seasoned minced meat stuffed in casings
savanna,a flat grassland in tropical or subtropical regions
savarin,a sponge cake baked in a ring mold
saveloy,a ready-cooked and highly seasoned pork sausage
saviour,a teacher and prophet born in Bethlehem and active in Nazareth; his life and sermons form the basis for Christianity (circa 4 BC - AD 29)
savitar,an important Hindu god; the sun in its life-giving aspect
savored,derive or receive pleasure from; get enjoyment from; take pleasure in
sawbill,large crested fish-eating diving duck having a slender hooked bill with serrated edges
sawbuck,a framework for holding wood that is being sawed
sawdust,fine particles of wood made by sawing wood
sawfish,primitive ray with sharp teeth on each edge of a long flattened snout
sawmill,a large sawing machine
sawwort,European perennial whose serrate leaves yield a yellow dye
saxhorn,any of a family of brass wind instruments that resemble a bugle with valves
scabies,a contagious skin infection caused by the itch mite; characterized by persistent itching and skin irritation
scalage,estimation of the amount of lumber in a log
scalded,subject to harsh criticism
scalene,of a triangle having three sides of different lengths
scaling,the act of arranging in a graduated series
scallop,one of a series of rounded projections (or the notches between them) formed by curves along an edge (as the edge of a leaf or piece of cloth or the margin of a shell or a shriveled red blood cell observed in a hypertonic solution etc.)
scalpel,a thin straight surgical knife used in dissection and surgery
scalper,someone who buys something and resells it at a price far above the initial cost
scamper,rushing about hastily in an undignified way
scandal,disgraceful gossip about the private lives of other people
scanner,someone who scans verse to determine the number and prosodic value of the syllables
scapose,resembling or consisting of a scape; having a bare leafless stalk growing directly from the ground
scapula,either of two flat triangular bones one on each side of the shoulder in human beings
scarfed,masturbate while strangling oneself
scarify,"puncture and scar (the skin), as for purposes or tribal identification or rituals"
scarily,in an alarming manner
scarlet,a variable color that is vivid red but sometimes with an orange tinge
scarred,mark with a scar
scatter,a haphazard distribution in all directions
scauper,a graver used to scoop out broad areas when engraving wood or metal
scenery,the painted structures of a stage set that are intended to suggest a particular locale
scented,cause to smell or be smelly
scepter,the imperial authority symbolized by a scepter
sceptic,someone who habitually doubts accepted beliefs
schemer,a planner who draws up a personal scheme of action
scherzi,a fast movement (usually in triple time)
scherzo,a fast movement (usually in triple time)
schinus,genus of evergreen shrubs and trees of tropical and subtropical regions of South and Central America and Canary Islands and China
scholar,a learned person (especially in the humanities); someone who by long study has gained mastery in one or more disciplines
scholia,a marginal note written by a scholiast (a commentator on ancient or classical literature)
sciaena,type genus of the Sciaenidae: croakers
sciarid,minute blackish gregarious flies destructive to mushrooms and seedlings
sciatic,relating to or caused by or afflicted with sciatica
science,a particular branch of scientific knowledge
scincid,alert agile lizard with reduced limbs and an elongated body covered with shiny scales; more dependent on moisture than most lizards; found in tropical regions worldwide
scincus,type genus of Scincidae
scirpus,rhizomatous perennial grasslike herbs
scissor,cut with or as if with scissors
sciurus,type genus of the Sciuridae; typical moderate-sized arboreal squirrels
scoffer,someone who eats food rapidly and greedily
scolder,someone (especially a woman) who annoys people by constantly finding fault
scolion,a song (sometimes improvised) sung by guests at a banquet
scollop,edible muscle of mollusks having fan-shaped shells; served broiled or poached or in salads or cream sauces
scomber,type genus of the Scombridae
scooped,take out or up with or as if with a scoop
scooter,a motorboat resembling a motor scooter
scoriae,the scum formed by oxidation at the surface of molten metals
